<?xml version="1.0" encoding="UTF-8"?>
<instance name="Ranku" xmlns:xsi="http://www.w3.org/2001/XMLSchema-instance" xsi:noNamespaceSchemaLocation="../xsd/instance.xsd">
	<activityTime val="30" />
	<allowSummon val="false" />
	<emptyDestroyTime val="300" />
	<spawnPoint spawnX="-19006" spawnY="277065" spawnZ="-13383" />
	<spawnlist>
		<group name="general">
			<spawn npcId="25542" x="-19056" y="278732" z="-15000" heading="0" respawn="0" />
		</group>
	</spawnlist>
</instance>