<?xml version="1.0" encoding="UTF-8"?>
<instance name="Secret Area in the Keucereus Fortress" xmlns:xsi="http://www.w3.org/2001/XMLSchema-instance" xsi:noNamespaceSchemaLocation="../xsd/instance.xsd">
	<activityTime val="15" />
	<allowSummon val="false" />
	<spawnPoint spawnX="-185057" spawnY="242821" spawnZ="1576" />
	<emptyDestroyTime val="300" />
	<spawnlist>
		<group name="general">
			<spawn npcId="32567" x="-23985" y="-8965" z="-5388" heading="0" respawn="0" />
		</group>
	</spawnlist>
</instance>
